Question;Réponse
"C&rsquo;est quoi exactement un cow-boy ?";« Cow » veut dire « vache » en anglais et « boy » veut dire « garçon »
Pourquoi y a-t-il eut la guerre entre les cow-boys et les Indiens ?;Les Indiens habitaient les régions d’Amérique depuis bien longtemps lorsque les Blancs voulurent conquérir leurs terres
Pourquoi le lion a-t-il une crinière ?;Le lion, roi de la savane africaine, a une grosse crinière autour de la tête, au niveau du cou
"C&rsquo;est quoi la robe d&rsquo;un cheval ?";Il s’agit de la couleur de ses poils
Quel animal était sacré pour les Égyptiens ?;Il s’agit du crocodile
Le pirate Barbe-Noire a-t-il vraiment existé ?;Oui 
"D&rsquo;où viennent les poissons panés&nbsp;?";On ne trouve pas de poissons panés dans la mer, ça c’est sûr 
Les Romains mangeaient-ils déjà des pizzas ?;Oui 
"C&rsquo;est quoi la danse africaine ?";La danse a une place très importante en Afrique
Pourquoi meurt-on ?;Tous les hommes naissent, grandissent, vieillissent et meurent
"Qu&rsquo;est-ce que l&rsquo;œil d&rsquo;un cyclone ?";Les cyclones sont les tempêtes les plus dévastatrices du monde
Pourquoi le cœur bat-il ?;Le cœur bat pour faire circuler le sang dans ton corps, comme une pompe
Qui sont les danseurs étoiles ?;Les danseurs étoiles sont les meilleurs danseurs de l’Opéra
"Qu&rsquo;appelle-t-on les claquettes ?";Les claquettes sont une danse qui se pratique en tapant avec ses pieds
"Qu&rsquo;appelle-t-on un tutu ?";Le tutu est le costume que porte habituellement les danseuses de ballets classiques
Pourquoi le français est-il la langue officielle de la danse classique ?;Le français est la langue utilisée pour la danse classique parce que les premiers danseurs professionnels sont apparus en France, à l’époque de Louis XIV, le Roi Soleil
"C&rsquo;est quoi la danse africaine ?";La danse a une place très importante en Afrique
Qui sont les danseurs étoiles ?;Les danseurs étoiles sont les meilleurs danseurs de l’Opéra
Combien de dents possède un dauphin ?;Le dauphin possède 200 dents, ce qui est énorme, puisque nous n’en possédons que 32 
"Qu&rsquo;appelle-t-on le melon du dauphin ?";Le melon du dauphin n’est pas son fruit préféré 
"Le dauphin est-il équipé d&rsquo;une sorte de radar ?";Oui 
"Comment s&rsquo;appelle le nez du dauphin ?";Le nez du dauphin s’appelle le rostre
Les hommes et les dauphins sont-ils amis ?;On raconte que certains dauphins ont sauvé des humains de la noyade ou auraient aidé des pêcheurs à attraper du poisson
Pourquoi doit-on trier les déchets ?;On doit trier les déchets car ils sont recyclés et réutilisés pour fabriquer d’autres objets
Quelles sont les différentes fonctions des joueurs de foot ?;Comme dans tous les sports, chaque joueur a une fonction particulière
"C&rsquo;est quoi les dents de sagesse ?";Les dents de sagesse sont au nombre de 4 : 2 en haut et 2 en bas
Combien a-t-on de dents ?;Lorsque l’on est petit on n’a que 20 dents
Tous les dinosaures avaient-ils les mêmes dents ?;Eh non 
"Qu&rsquo;appelle-t-on les dents de lait ?";Les dents de lait sont les 20 premières dents qui poussent lorsque l’on est bébé
Comment font les animaux sauvages pour survivre sans eau, dans le désert ?;Les animaux sauvages qui vivent dans le désert trouvent de quoi boire grâce à l’eau contenue dans le sang des animaux qu’ils tuent pour se nourrir
Pourquoi Mickey porte-t-il des gants ?;Mickey Mouse apparaît en 1928 dans un dessin animé produit par Disney
Pourquoi Mickey porte-t-il des gants ?;Mickey Mouse apparaît en 1928 dans un dessin animé produit par Disney
À quoi servaient les temples grecs ?;Les Grecs construisirent des temples pour vénérer leurs dieux
Où avaient lieu les jeux olympiques ?;Ils se déroulaient à Olympie, en l’honneur de Zeus, le roi des dieux : le lieu où vivaient les dieux était le mont Olympe, à Olympie
"Qui régnait sur l&rsquo;Égypte ancienne ?";Les pharaons étaient les rois d’Égypte
"Le nombre d&rsquo;espèces a-t-il diminué pendant le règne des dinosaures ?";Non, absolument pas, c’est même l’inverse 
"Pourquoi les vaches ont-elles toujours l&rsquo;air de mâcher ?";La vache passe presque toute la journée à brouter
"Quelle était la taille du cerveau des dinosaures&nbsp;?";Bien que les dinosaures furent des créatures gigantesques, la plupart d’entre eux avait un tout petit cerveau
Est-ce que les dinosaures ont vraiment existé ?;Oui, bien sûr 
"À l&rsquo;époque des dinosaures, est-ce que d&rsquo;autres animaux vivaient sur la Terre ?";Bien sûr 
De quelle couleur étaient les dinosaures ?;Vert 
Les mammouths ont-ils vécu à la même période que les dinosaures ?;Non, les mammouths n’ont pas vécu à la même période que les dinosaures
Le diplodocus était-il herbivore ou carnivore ?;Le diplodocus était un dinosaure herbivore
Quel règne animal a suivi la disparition des dinosaures ?;Les dinosaures ont disparu, sans doute victime de la chute d’une météorite sur la Terre
"Comment appelle-t-on la plus haute tour d&rsquo;un château fort ?";La plus haute tour d’un château fort s’appelle le donjon
Pourquoi doit-on dormir ?;Lorsque l’on dort, le corps fonctionne au ralenti, ce qui permet à tous les organes et particulièrement au cerveau de se reposer
Comment vaut-il mieux se laver ?;Il vaut mieux se laver en privilégiant une courte douche et surtout bien couper l’eau pendant que l’on se lave
"Que sont les douves d&rsquo;un château fort ?";Les douves d’un château fort sont des immenses fossés remplis d’eau qui entourent la forteresse
Est-ce que les dinosaures ont vraiment existé ?;Oui, bien sûr 
"Comment les pirates annonçaient-ils le début d&rsquo;une attaque ?";Pour annoncer une attaque, les pirates hissaient le drapeau noir
Le cheval est-il gentil ?;Le cheval n’est ni méchant, ni gentil
Comment les chevaux sont-ils dressés ?;Le cheval est un animal craintif, donc plus facile à dresser que certains autres animaux
Le chameau a-t-il une ou deux bosses ?;Le chameau a deux bosses
Combien de temps dure un match de foot ?;Un match est composé de deux périodes de 45 minutes que l’on appelle des mi-temps
"D&rsquo;où viennent les glaçons ?";Eh oui 
"Où va l&rsquo;eau des toilettes ?";L’eau des toilettes est transportée dans des tuyaux jusqu’à des usines de nettoyage
"D&rsquo;où provient l&rsquo;eau que les pompiers utilisent pour éteindre les feux ?";Avec leur camion rouge équipé d’un long tuyau que l’on appelle lance à incendie, les pompiers déverse de l’eau sur les feux
Pourquoi y a-t-il de la neige en haut des montagnes ?;Tout en haut des hautes montagnes, l’air est très froid 
"Pourquoi faut-il économiser l&rsquo;eau ?";Les êtres humains, les plantes et les animaux ont besoin d’eau pour vivre
"Sur Terre, tous les individus ont accès à l&rsquo;eau potable ?";Malheureusement non 
"Est-ce que les écailles des poissons grandissent&nbsp;?";Eh oui 
"D&rsquo;où viennent les éclairs ?";Les éclairs dans le ciel viennent de la foudre, une étincelle géante qui se forme à l’intérieur d’un nuage d’orage, chargé d’électricité
"Au Moyen Âge, est-ce que les enfants allaient à l&rsquo;école ?";Très peu d’enfants allaient en classe, car peu d’écoles existaient
Existe-t-il des maisons en paille et en bois ?;Oui 
Comment vaut-il mieux se laver ?;Il vaut mieux se laver en privilégiant une courte douche et surtout bien couper l’eau pendant que l’on se lave
Que doit-on faire pour respecter les arbres ?;Les arbres sont vivants et sont les poumons de la planète 
"Qu&rsquo;appelle-t-on des éoliennes ?";Les éoliennes sont des sortes de grands moulins à vent qui produisent de l’électricité
"C&rsquo;est quoi le climat ?";Tu as peut-être remarqué que les arbres ne sont pas les mêmes d’une région à l’autre : la jungle équatoriale, la savane africaine ou les forêts tempérées… Même si la météo change tous les jours, elle..
"Pourquoi faut-il économiser l&rsquo;eau ?";Les êtres humains, les plantes et les animaux ont besoin d’eau pour vivre
"Comment s&rsquo;appelait l&rsquo;écriture chez les Égyptiens ?";L’écriture chez les Égyptiens s’appelle les hieroglyphes
Les Égyptiens savaient-ils écrire ?;Dans l’Égypte ancienne, seuls les princes et les scribes savaient écrire
À quel âge devenait-on chevalier ?;Vers 7 ans, le futur chevalier entrait au service d’un noble, en tant que page
Le cheval est-il gentil ?;Le cheval n’est ni méchant, ni gentil
Pourquoi y a-t-il des plaques sur le sol de Paris ?;Les plaques sur le sol de Paris permettent de fermer l’accès aux égouts
"Quel est l&rsquo;homme qui a déchiffré les hiéroglyphes ?";L’homme qui a su déchiffrer les hiéroglyphes est Jean-François Champollion
"Dans l&rsquo;Égypte ancienne, les momies n&rsquo;existaient-elles que pour les hommes ?";Eh non 
Avec quel matériau les Égyptiens construisaient-ils leurs maisons ?;Les Égyptiens construisaient leurs maisons avec des briques fabriquées à partir de boue séchée, issue du Nil
"Comment s&rsquo;appelait l&rsquo;écriture chez les Égyptiens ?";L’écriture chez les Égyptiens s’appelle les hieroglyphes
Quel animal était sacré pour les Égyptiens ?;Il s’agit du crocodile
"D&rsquo;où vient la lumière des lampes ?";La lumière arrive dans les maisons grâce à l’électricité qui vient par des fils, cachés à l’intérieur des murs
"Quel animal donne une fessée à son petit lorsqu&rsquo;il n&rsquo;est pas sage ?";C’est la maman éléphant
Quelles sont les principales émotions ?;Les principales émotions sont au nombre de six : la joie, la tristesse, la peur, la colère, le dégoût et la surprise
"Pourquoi les empereurs romains levaient-ils le pouce lors d&rsquo;un combat de gladiateurs ?";Les empereurs romains levaient ou baissaient le pouce lors des jeux, à la fin d’un combat de gladiateurs
Jules César fut-il empereur romain ?;Eh non 
Qui était Jules César ?;Jules César était un grand général de l’armée romaine, qui en réalité n’a jamais été empereur 
Qui étaient vraiment les Romains ?;Les Romains étaient le peuple de Rome, capitale de l’Italie actuelle, il y a plus de 2 000 ans
Pourquoi doit-on manger ?;Le corps a besoin de nourriture pour bien fonctionner, comme une voiture a besoin d’essence 
"Qu&rsquo;appelle-t-on des éoliennes ?";Les éoliennes sont des sortes de grands moulins à vent qui produisent de l’électricité
Existe-t-il des maisons en paille et en bois ?;Oui 
Le pétrole risque-t-il de complètement disparaître ?;Oui, bien sûr 
"Au Moyen Âge, est-ce que les enfants allaient à l&rsquo;école ?";Très peu d’enfants allaient en classe, car peu d’écoles existaient
"Que sont les petits rats de l&rsquo;Opéra ?";Les petits rats de l’opéra sont les jeunes élèves de l’école de danse de l’Opéra de Paris
"Que sont les douves d&rsquo;un château fort ?";Les douves d’un château fort sont des immenses fossés remplis d’eau qui entourent la forteresse
Pourquoi les pirates ont-ils des surnoms ?;C’est une façon de faire peur à leurs ennemis
"Qu&rsquo;est-ce qu&rsquo;une éolienne ?";C’est une immense machine, formée de 3 pales, comme une hélice, qui tourne et produit de l’électricité, grâce à la force du vent
Trouve-t-on vraiment des éponges dans la mer ?;Eh oui 
"C&rsquo;est quoi un supporter ?";Un supporter c’est une personne, homme ou femme, qui soutient une équipe de football
Comment les pompiers sont-ils équipés ?;Les pompiers, heureusement, ont des équipements très adaptés 
"À quoi sert le numéro sur le maillot d&rsquo;un footballeur ?";Grâce à leur maillot, les joueurs d’une équipe se reconnaissent sur le terrain
"C&rsquo;est quoi exactement un volcan ?";Un volcan c’est un trou dans la Terre
Qui devenait pirate ?;C’étaient souvent d’anciens corsaires au service du roi qui décidaient d’attaquer des navires pour leur propre compte
"Comment dorment les astronautes, dans l&rsquo;espace ?";Dans l’espace, il n’y a pas de gravité terrestre, c’est-à-dire que rien n’est retenu au sol
De quoi sont constituées les étoiles ?;Les étoiles sont composées de gaz, comme l’air qui nous entoure
A-t-on déjà vu des extraterrestres ?;On n’a encore jamais vraiment eu la preuve infaillible que les extraterrestres existent
"C&rsquo;est quoi une comète ?";Une comète est une boule de glace et de poussières qui tourne autour du Soleil
"C&rsquo;est quoi une météorite ?";Une météorite est un énorme caillou qui traverse l’espace et tombe sur la Terre
"Qui dirigeait les cérémonies sacrées, chez les Indiens d&rsquo;Amérique ?";Celui qui dirigeait les cérémonies sacrées chez les Indiens d’Amérique était le chef de la tribu
Comment font les étoiles de mers pour manger ?;Les étoiles de mer raffolent des coquillages
De quoi sont constituées les étoiles ?;Les étoiles sont composées de gaz, comme l’air qui nous entoure
Quelle est la différence entre une étoile et une planète ?;La différence entre une étoile et une planète se trouve dans sa taille
"C&rsquo;est quoi l&rsquo;Univers ?";L’Univers, c’est tout ce qui nous entoure : les étoiles, les planètes, l’espace… Il est infiniment grand 
Le Soleil est-il une étoile ?;Eh oui 
Les étoiles filantes sont-elles des étoiles ?;Eh bien non 
Comment font les étoiles de mers pour manger ?;Les étoiles de mer raffolent des coquillages
"C&rsquo;est quoi une comète ?";Une comète est une boule de glace et de poussières qui tourne autour du Soleil
"Comment s&rsquo;appelle la monnaie que l&rsquo;on utilise en Europe ?";La monnaie utilisée en Europe s’appelle l’euro
"Comment s&rsquo;appelle la monnaie que l&rsquo;on utilise en Europe ?";La monnaie utilisée en Europe s’appelle l’euro
Pourquoi appelait-on les soldats de la Première Guerre mondiale des poilus ?;Deux raisons : la première est que, dans les tranchées, il n’y avait aucun répit pour se laver ou se raser
Pourquoi les mammouths ont-ils disparu ?;Les mammouths se sont éteints car leur fourrure n’était plus adaptée au climat
Comment les dinosaures se sont-ils éteints ?;Les dinosaures se seraient éteints après la chute d’une énorme météorite sur la Terre
Combien de temps les dinosaures ont vécu sur Terre ?;Les premiers dinosaures sont apparus il y a à peu près 230 millions d’années et les derniers se sont éteints il y a environ 65 millions d’années
A-t-on déjà vu des extraterrestres ?;On n’a encore jamais vraiment eu la preuve infaillible que les extraterrestres existent
Comment fabrique-t-on du verre ?;Pour fabriquer du verre, il faut mélanger du sable avec deux produits chimiques : de la soude et de la chaux que l’on chauffe à 1 600 °C, ce qui est très chaud 
"D&rsquo;où viennent les céréales ?";Les céréales que l’on mange le matin avec du lait viennent des graines des plantes, comme le blé, le riz, le maïs
Qui pique chez les moustiques, le mâle ou la femelle ?;Les moustiques qui piquent sont les femelles 
Que faisaient les femmes à la préhistoire ?;Pendant la préhistoire, la principale tâche des femmes était de surveiller le feu, de façon à ce qu’il ne s’éteigne pas
Pourquoi au Moyen Âge, les femmes sortaient-elles avec des chaussures aux épaisses semelles ?;Au Moyen Âge, les rues des villes étaient extrêmement sales
Y a-t-il eut des femmes pirates ?;Oui, il y en eut quelques-unes
Les femmes préhistoriques portaient-elles des bijoux ?;Eh oui, les hommes préhistoriques étaient de galants hommes 
À quoi servent les très grandes oreilles du fennec, petit renard du désert ?;Les oreilles du fennec lui servent à laisser partir la chaleur de son corps 
"C&rsquo;est quoi exactement un cow-boy ?";« Cow » veut dire « vache » en anglais et « boy » veut dire « garçon »
"Qu&rsquo;est-ce que c&rsquo;est que la basse-cour, dans la ferme ?";C’est là que vivent les animaux tels que les poules, les oies, les canards, les pintades, les dindons… tous les animaux à plumes 
"Pourquoi les vaches ont-elles toujours l&rsquo;air de mâcher ?";La vache passe presque toute la journée à brouter
Le cochon est-il sale ?;Bien au contraire 
Y a-t-il un poussin dans tous les œufs de poule ?;La poule pond presque tous les jours
Pourquoi met-on des fers sur les sabots des poneys et des chevaux ?;Les fers sont faits pour protéger les sabots des chevaux et des poneys
"D&rsquo;où provient l&rsquo;eau que les pompiers utilisent pour éteindre les feux ?";Avec leur camion rouge équipé d’un long tuyau que l’on appelle lance à incendie, les pompiers déverse de l’eau sur les feux
Que faisaient les femmes à la préhistoire ?;Pendant la préhistoire, la principale tâche des femmes était de surveiller le feu, de façon à ce qu’il ne s’éteigne pas
Pourquoi les pompiers ont-ils une grande échelle ?;L’échelle des pompiers mesure près de 30 mètres de haut, la taille d’un immeuble de 7 étages 
Pourquoi les vêtements des pompiers ne brûlent-ils pas ?;Les vêtements des pompiers ne brûlent pas dans le feu parce qu’ils sont fabriqués dans un tissu spécialement conçu pour résister à la chaleur des flammes
Comment les hommes préhistoriques allumaient-ils les feux ?;Ils frottaient des pierres les unes avec les autres
Que mangeaient les dinosaures herbivores ?;Ils mangeaient des feuilles d’arbre
Est-ce que les acrobates de cirque tombent souvent ?;Non, les acrobates de cirque ne tombent pas souvent
Pourquoi les filles se maquillent-elles ?;Déjà, toutes les filles ne se maquillent pas
Y a-t-il des chiens pompiers ?;Oui, il existe des chiens spécialement entraînés pour aider les pompiers à retrouver des gens sous des bâtiments écroulés, par exemple
Pourquoi le flamant est-il rose ?;C’est à cause de son alimentation 
Pourquoi les fleurs sentent-elles si bon ?;Les fleurs sentent bon pour attirer les insectes et notamment les abeilles
La Seine est-elle le plus long fleuve de France ?;Eh non 
"La plupart des fleuves d&rsquo;Europe sont-ils pollués ?";Malheureusement oui
"Comment s&rsquo;appelle le fleuve qui traverse l&rsquo;Égypte ?";Ce fleuve s’appelle le Nil
Quel animal était sacré pour les Égyptiens ?;Il s’agit du crocodile
Pourquoi les poissons ne coulent-ils pas ?;Les poissons ne coulent pas grâce à une petite poche de gaz, à l’intérieur de leur corps qui leur permet de flotter
"Comment devient-on footballeur professionnel&nbsp;?";Devenir footballeur professionnel est un rêve pour beaucoup, mais attention : c’est un peu le parcours du combattant 
Qui était Pelé ?;Pelé est un footballeur brésilien, considéré comme le plus grand joueur de football de tous les temps
Qui a inventé le football ?;En réalité, le football serait inspiré d’un sport pratiqué en France il y a très longtemps
Comment les joueurs de foot se protègent-ils ?;Les joueurs de foot se protègent des éventuels coups des autres joueurs avec des protège-tibias sur le devant des jambes
Combien de temps dure un match de foot ?;Un match est composé de deux périodes de 45 minutes que l’on appelle des mi-temps
Les tremblements de terre ont-ils tous la même force ?;Eh non, bien sûr 
Pourquoi les pompiers font-ils beaucoup de sport ?;Les pompiers font beaucoup de sport pour être en forme
Pourquoi la forêt amazonienne est-elle en danger ?;La forêt amazonienne est en danger car elle subit une déforestation massive, c’est-à-dire que l’on coupe beaucoup d’arbres pour laisser de la place aux cultures
Que doit-on faire pour respecter les arbres ?;Les arbres sont vivants et sont les poumons de la planète 
Comment le boa tue-t-il les animaux dont il veut se nourrir ?;Dans les forêts amazonniennes d’Amérique, cet énorme serpent qu’est le boa s’enroule autour de l’animal et serre doucement ses anneaux jusqu’à l’étouffer !..
Y a-t-il un chef dans les groupes de gorilles ?;Dans les forêts tropicales d’Afrique, les gorilles vivent en groupe
Y a-t-il un chef dans les groupes de gorilles ?;Dans les forêts tropicales d’Afrique, les gorilles vivent en groupe
Comment le boa tue-t-il les animaux dont il veut se nourrir ?;Dans les forêts amazonniennes d’Amérique, cet énorme serpent qu’est le boa s’enroule autour de l’animal et serre doucement ses anneaux jusqu’à l’étouffer !..
"Qui fabriquait l&rsquo;armure des chevaliers ?";L’homme qui fabriquait l’armure des chevaliers était le forgeron
La Terre a-t-elle toujours existé ?;Eh non 
"D&rsquo;où viennent les éclairs ?";Les éclairs dans le ciel viennent de la foudre, une étincelle géante qui se forme à l’intérieur d’un nuage d’orage, chargé d’électricité
"Qu&rsquo;est-ce qu&rsquo;un insecte ?";Un insecte se caractérise par ses 3 paires de pattes, soit 6 en tout
La Seine est-elle le plus long fleuve de France ?;Eh non 
"Quel est le nom de la chaîne de montagnes qui sépare la France de l&rsquo;Italie ?";La chaîne des Alpes est une frontière naturelle entre la France, l’Italie et la Suisse
Y a-t-il du pétrole en France ?;Eh bien oui 
"Quel était l&rsquo;ancien nom de Paris ?";Avant de s’appeler Paris, la capitale se nommait Lutèce
Sur quel continent se trouve la France ?;Le continent où se trouve la France s’appelle l’Europe
"D&rsquo;où viennent les glaçons ?";Eh oui 
"C&rsquo;est quoi une galaxie ?";Des morceaux de l’Univers se sont réunis et ont formé des galaxies
Pourquoi les filles se maquillent-elles ?;Déjà, toutes les filles ne se maquillent pas
La Seine est-elle le plus long fleuve de France ?;Eh non 
"Quel est le nom de la chaîne de montagnes qui sépare la France de l&rsquo;Italie ?";La chaîne des Alpes est une frontière naturelle entre la France, l’Italie et la Suisse
Y a-t-il du pétrole en France ?;Eh bien oui 
"Quel était l&rsquo;ancien nom de Paris ?";Avant de s’appeler Paris, la capitale se nommait Lutèce
"Est-ce que les mers et les océans, c&rsquo;est la même chose ?";Eh bien non
Pourquoi la girafe a un si long cou ?;La girafe a un très long cou pour pouvoir manger les petites feuilles tendres, tout en haut des acacias, ces très grands arbres que l’on trouve dans la savane africaine
Quel est le plus grand bébé du monde ?;Il s’agit du girafeau, le bébé de la girafe
"D&rsquo;où viennent les glaçons ?";Eh oui 
Que sont les icebergs ?;Les icebergs sont des énormes blocs de glace qui se sont détachés de la banquise
"Où se déroulaient les spectacles de gladiateurs&nbsp;?";Les spectacles de gladiateurs se déroulaient dans des amphithéâtres, immenses théâtres ronds, où les bancs sont placés tout autour, en escalier
"Pourquoi les empereurs romains levaient-ils le pouce lors d&rsquo;un combat de gladiateurs ?";Les empereurs romains levaient ou baissaient le pouce lors des jeux, à la fin d’un combat de gladiateurs
Qui étaient les gladiateurs ?;Les gladiateurs étaient soit des hommes qui se battaient pour de l’argent, soit des esclaves qui essayaient de gagner leur liberté ou encore des bandits qui, à la place d’être en prison, risquaient leur..
Où vivent les gorilles ?;Les gorilles vivent dans les forêts humides d’Afrique
Quelle est la meilleure mère du règne animal ?;La maman gorille est l’une des mères les plus douces avec son petit
Y a-t-il un chef dans les groupes de gorilles ?;Dans les forêts tropicales d’Afrique, les gorilles vivent en groupe
Pourquoi les pompiers ont-ils une grande échelle ?;L’échelle des pompiers mesure près de 30 mètres de haut, la taille d’un immeuble de 7 étages 
À quoi servaient les temples grecs ?;Les Grecs construisirent des temples pour vénérer leurs dieux
Où avaient lieu les jeux olympiques ?;Ils se déroulaient à Olympie, en l’honneur de Zeus, le roi des dieux : le lieu où vivaient les dieux était le mont Olympe, à Olympie
Que perdent le bébé crapaud et le bébé grenouille en grandissant ?;Ils perdent leur queue 
Peut-on manger des insectes ?;Oui, dans certaines régions du monde, comme l’Asie ou l’Afrique, on mange beaucoup d’insectes grillés, comme les grillons
Pourquoi le chat fait-il le gros dos ?;On sait qu’un chat n’est pas content lorsqu’il montre les dents, remue la queue, baisse les oreilles et surtout quand il fait le gros dos et qu’il hérisse ses poils 
Où vivaient les hommes préhistoriques ?;Les hommes préhistoriques vivaient dans des grottes, où ils se protégeaient du froid, de la pluie, et surtout dans lesquelles ils préservaient leur feu, garantie de leur survie
Où vivaient les hommes préhistoriques ?;Ils vivaient dans des grottes, pour se protéger du froid et de la pluie
"Qu&rsquo;est-ce que le travail sur un chantier ?";  Le travail sur un chantier est assez difficile et dangereux
Pourquoi y a-t-il des grues sur les chantiers ?;Les grues servent à soulever de lourdes charges, comme les poutres metalliques ou les blocs de beton
Pourquoi les guêpes piquent ?;Les guêpes piquent lorsqu’elles se sentent menacées
Pourquoi appelait-on les soldats de la Première Guerre mondiale des poilus ?;Deux raisons : la première est que, dans les tranchées, il n’y avait aucun répit pour se laver ou se raser
"Comment s&rsquo;appelait la technique qui consistait à encercler un château fort ennemi ?";Cette technique de guerre s’appelle le siège
"Comment s&rsquo;appelaient les soldats romains ?";Les soldats romains s’appelaient les légionnaires
"En cas d&rsquo;attaque, comment s&rsquo;appelait la technique de défense des légionnaires romains ?";Cette technique s’appellait la tortue
Pourquoi les pirates avaient-ils souvent une jambe de bois, un œil ou un bras en moins ?;Lors des combats, les attaques étaient violentes et les blessures nombreuses 
