Question;Réponse
À quoi servaient les temples grecs ?;Les Grecs construisirent des temples pour vénérer leurs dieux
"Le nombre d&rsquo;espèces a-t-il diminué pendant le règne des dinosaures ?";Non, absolument pas, c’est même l’inverse 
"Pourquoi récupère-t-on l&rsquo;eau de pluie ?";Certaines personnes récupère l’eau de pluie dans de grandes cuves, placée sous les gouttières d’une maison
Le pétrole risque-t-il de complètement disparaître ?;Oui, bien sûr 
Les dinosaures ne vivaient-ils que sur la terre ferme ?;Eh oui 
"Qu&rsquo;y avait-il sur Terre avant les dinosaures ?";Les dinosaures font partie des premiers êtres vivants qui ont peuplé la Terre
"Le foot ne se joue-t-il qu&rsquo;avec les pieds ?";Eh non 
Pourquoi les fauves obéissent-ils au dompteur, dans un cirque ?;Les fauves (lions, tigres…) obéissent parce que ce sont des animaux dressés
"Comment s&rsquo;appelaient les tentes dans lesquelles vivaient les Indiens d&rsquo;Amérique ?";Les tentes des Indiens s’appelaient des tipis
Pourquoi les Indiens habitaient-ils dans des tipis ?;Les Indiens étaient un peuple de nomades, c’est-à-dire qu’ils se déplaçaient au rythme des saisons, pour suivre les troupeaux de bisons dont ils se nourrissaient
Comment fabrique-t-on des vêtements de coton ?;Le coton est une matière blanche, douce, qui entoure la graine de cotonnier
Que sont les icebergs ?;Les icebergs sont des énormes blocs de glace qui se sont détachés de la banquise
"Comment les araignées fabriquent-elles leur fil&nbsp;?";Les araignées fabriquent un fil collant, très solide et un peu élastique dans leur ventre, l’abdomen, pour construire leur toile
"Qu&rsquo;est-ce qu&rsquo;un « tomahawk » chez les Indiens d&rsquo;Amérique ?";Le « tomahawk », chez les Indiens d’Amérique est une sorte de massue, comme un marteau, à laquelle était attachée une grosse pierre...
Les Romains mangeaient-ils déjà des pizzas ?;Oui 
Qui était Toutankhamon ?;Toutankhamon était un pharaon d’Égypte, mort à 19 ans
"D&rsquo;où viennent les éclairs ?";Les éclairs dans le ciel viennent de la foudre, une étincelle géante qui se forme à l’intérieur d’un nuage d’orage, chargé d’électricité
Pourquoi doit-on tondre les moutons ?;On tond les moutons une fois par an, juste avant l’été, car leur laine leur tiendrait trop chaud
Où naissent les bébés tortues de mer ?;Les pauvres bébés tortues naissent sur la plage, tout seul 
"Comment appelle-t-on la plus haute tour d&rsquo;un château fort ?";La plus haute tour d’un château fort s’appelle le donjon
Pourquoi les chevaliers participaient-ils à des tournois ?;Les chevaliers participaient à des tournois de façon à mesurer leur force, les uns vis-à-vis des autres
Quelle est la hauteur de la tour Eiffel ?;La tour Eiffel mesure très exactement 320 mètres de haut
Qui était Toutankhamon ?;Toutankhamon était un pharaon d’Égypte, mort à 19 ans
Que signifie le mot « origami » ?;L’origami, cet art délicat du pliage du papier, est un mot japonais qui signifie plier (« oru ») et papier (« kami »)
Quelle doit être la température du corps ?;La température, à l’intérieur du corps doit être de 37 °C
Pourquoi doit-on se laver ?;On doit se laver pour garder son corps en bonne santé
Pourquoi transpires-tu quand tu as chaud ?;Lorsque tu fais un effort comme courir ou sauter, ton corps fournit de l’énergie
Que permirent les voyages en avion ?;L’invention de l’avion permit de voyager beaucoup plus vite
Est-ce que le tout premier vélo avait des pédales ?;Eh bien non 
Quelle est la différence entre un tramway et un métro ?;Dans les grandes villes, un métro est un moyen de transport souterrain qui permet de se déplacer rapidement d’un endroit à un autre
"Pourquoi un chantier, c&rsquo;est long ?";Un chantier c’est long, parce que cela prend du temps de construire une maison ou un immeuble 
Les tremblements de terre ont-ils tous la même force ?;Eh non, bien sûr 
"À quoi servaient les pyramides, à l&rsquo;époque des pharaons ?";Les pyramides étaient leur tombeaux
"L&rsquo;or était-il le trésor le plus recherché des pirates ?";Non 
Pourquoi doit-on trier les déchets ?;On doit trier les déchets car ils sont recyclés et réutilisés pour fabriquer d’autres objets
Qui étaient les Sioux ?;Les Sioux étaient l’une des tribus indiennes qui habitaient le continent américain
Les tricératops se battaient-ils entre eux ?;Oui 
Combien de cornes possédait le tricératops ?;Le tricératops, ce tranquille herbivore possédait trois cornes : « tri » de « tricératops » veut dire « trois »
"Qu&rsquo;est-ce que l&rsquo;œil d&rsquo;un cyclone ?";Les cyclones sont les tempêtes les plus dévastatrices du monde
Y a-t-il un chef dans les groupes de gorilles ?;Dans les forêts tropicales d’Afrique, les gorilles vivent en groupe
"Qu&rsquo;appelle-t-on un tutu ?";Le tutu est le costume que porte habituellement les danseuses de ballets classiques
Le tyrannosaure était-il herbivore ou carnivore ?;Le tyrannosaure était l’un des plus grands dinosaures carnivores
A-t-on déjà vu des extraterrestres ?;On n’a encore jamais vraiment eu la preuve infaillible que les extraterrestres existent
"C&rsquo;est quoi l&rsquo;Univers ?";L’Univers, c’est tout ce qui nous entoure : les étoiles, les planètes, l’espace… Il est infiniment grand 
"C&rsquo;est quoi une galaxie ?";Des morceaux de l’Univers se sont réunis et ont formé des galaxies
Le Soleil est-il une étoile ?;Eh oui 
Pourquoi la Lune brille-t-elle ?;Parce que le Soleil l’éclaire
Pourquoi les camions de pompiers ont-ils une sirène ?;Comme tous les véhicules d’urgence : voiture de police, ambulance…, les camions de pompiers ont une sirène
Les pets des vaches sont-ils polluants ?;Oui 
"Est-ce qu&rsquo;un bœuf et un taureau, c&rsquo;est la même chose ?";Le taureau est le mâle qui s’accouple avec la vache pour faire de petits
"C&rsquo;est quoi exactement un cow-boy ?";« Cow » veut dire « vache » en anglais et « boy » veut dire « garçon »
Combien de litres de lait donne une vache par jour ?;Une vache est traite deux fois par jours, le matin et le soir, tous les jours de l’année
"Pourquoi les vaches ont-elles toujours l&rsquo;air de mâcher ?";La vache passe presque toute la journée à brouter
Pourquoi y a-t-il des vagues sur la mer ?;Le vent, en déplaçant l’eau à la surface de la mer, forme les vagues
"D&rsquo;où vient le sable, sur les plages ?";Le sable des plages est en fait de minuscules petits morceaux de roches et de coquillages qui ont été broyés par la mer
Que permirent les voyages en avion ?;L’invention de l’avion permit de voyager beaucoup plus vite
Est-ce que le tout premier vélo avait des pédales ?;Eh bien non 
"Comment s&rsquo;appelle le moyen de transport que se déplace sous la mer ?";Il s’agit du sous-marin
Quelle est la différence entre un tramway et un métro ?;Dans les grandes villes, un métro est un moyen de transport souterrain qui permet de se déplacer rapidement d’un endroit à un autre
En quoi étaient faites les roues des premières voitures ?;Les roues des premières voitures n’étaient pas faites en caoutchouc comme maintenant, mais elles étaient en bois
Est-ce que le tout premier vélo avait des pédales ?;Eh bien non 
Le scorpion est-il dangereux ?;Oui, le scorpion est un animal très dangereux, malgré sa petite taille
"Qu&rsquo;est-ce qu&rsquo;une éolienne ?";C’est une immense machine, formée de 3 pales, comme une hélice, qui tourne et produit de l’électricité, grâce à la force du vent
"Qu&rsquo;appelle-t-on des éoliennes ?";Les éoliennes sont des sortes de grands moulins à vent qui produisent de l’électricité
Pourquoi y a-t-il des vagues sur la mer ?;Le vent, en déplaçant l’eau à la surface de la mer, forme les vagues
"Comment s&rsquo;appelle le plus célèbre chef gaulois qui s&rsquo;opposa aux Romains ?";Il s’agit de Vercingétorix
Comment fabrique-t-on des vêtements de coton ?;Le coton est une matière blanche, douce, qui entoure la graine de cotonnier
"D&rsquo;où vient mon pull bleu ?";Il ne vient pas d’un mouton bleu 
Pourquoi les vêtements des pompiers ne brûlent-ils pas ?;Les vêtements des pompiers ne brûlent pas dans le feu parce qu’ils sont fabriqués dans un tissu spécialement conçu pour résister à la chaleur des flammes
Comment les pirates repéraient-ils les navires à attaquer ?;L’un des pirates, tout en haut du mât, surveillait l’horizon avec une longue vue
Les Vikings étaient-ils des pirates ?;Oui, mais pas seulement 
Pourquoi y a-t-il des jardins sur les toits de Paris ?;Paris est hélas l’une des mégalopoles comptant le moins d’arbres par habitant
Pourquoi y a-t-il des plaques sur le sol de Paris ?;Les plaques sur le sol de Paris permettent de fermer l’accès aux égouts
Pourquoi y a-t-il de grands immeubles à Paris ?;Il y a de grands immeubles à Paris car de plus en plus de monde habite les grandes villes comme Paris
Sur Terre, les hommes vivent-ils plus dans les villes ou les villages ?;Les hommes vivent plus dans les villes
"Existe-il d&rsquo;autres Paris dans le monde ?";Eh bien oui 
Comment les chats voient-ils la nuit ?;Les chats voient beaucoup mieux que nous dans l’obscurité
Que permirent les voyages en avion ?;L’invention de l’avion permit de voyager beaucoup plus vite
En quoi étaient faites les roues des premières voitures ?;Les roues des premières voitures n’étaient pas faites en caoutchouc comme maintenant, mais elles étaient en bois
Comment la voix sort-elle du téléphone ?;La voix est transportée par des ondes qui se déplacent très vite
Sur la plage, le sable est-il toujours jaune ?;Eh non 
"C&rsquo;est quoi exactement un volcan ?";Un volcan c’est un trou dans la Terre
Y a-t-il des volcans sous la mer ?;Oui 
Les volcans crachent-ils tous de la lave ?;Eh non 
Qui sont les pompiers ?;Pour certains, c’est leur métier d’être pompiers
"Qu&rsquo;est-ce qu&rsquo;un ornithorynque ?";L’ornithorynque est un mammifère amphibie (qui vit sur Terre et dans l’eau) au corps poilu, avec des pattes palmées munies de griffes, une queue de castor et un bec de canard 
"Vos questions : « Pourquoi l&rsquo;escargot à 2 longues cornes et 2 courtes ? »";Eh oui 
Pourquoi les zèbres ont-ils des rayures ?;Certains scientifiques ont dit que les zèbres avaient des rayures pour se camoufler dans la savane et d’autres pour lutter contre la chaleur
Où avaient lieu les jeux olympiques ?;Ils se déroulaient à Olympie, en l’honneur de Zeus, le roi des dieux : le lieu où vivaient les dieux était le mont Olympe, à Olympie
"Comment les araignées fabriquent-elles leur fil&nbsp;?";Les araignées fabriquent un fil collant, très solide et un peu élastique dans leur ventre, l’abdomen, pour construire leur toile
"D&rsquo;où vient le miel ?";Ce sont les abeilles qui fabriquent le miel
Pourquoi les fleurs sentent-elles si bon ?;Les fleurs sentent bon pour attirer les insectes et notamment les abeilles
Les abeilles piquent-elles ?;Oui, les abeilles piquent et en meurent même 
"Comment les pirates annonçaient-ils le début d&rsquo;une attaque ?";Pour annoncer une attaque, les pirates hissaient le drapeau noir
Les pompiers sont-ils médecins ?;Non, mais lorsqu’ils apprennent leur métier, ils sont formés aux gestes de premiers secours, comme arrêter un saignement, aider quelqu’un à respirer ou immobiliser une personne blessée
Pourquoi les camions de pompier sont rouges avec une sirène ?;Les camions de pompier sont rouges de façon à bien se distinguer
Est-ce que les acrobates de cirque tombent souvent ?;Non, les acrobates de cirque ne tombent pas souvent
Combien a-t-on de dents ?;Lorsque l’on est petit on n’a que 20 dents
Sur quel continent seraient apparus les premiers hommes ?;Les premiers hommes seraient apparus en Afrique
Où vivent les gorilles ?;Les gorilles vivent dans les forêts humides d’Afrique
Existe-il toujours des pirates ?;Eh oui 
Sur quel continent sont apparus les premiers hommes ?;C’est en Afrique que l’on a retrouvé les ossements humains les plus anciens
"Comment s&rsquo;appelle le fleuve qui traverse l&rsquo;Égypte ?";Ce fleuve s’appelle le Nil
Le plus vieil arbre du monde a-t-il plus de 4 000 ans ?;Eh oui 
Que mange la baleine ?;La baleine est le mammifère marin le plus grand au monde
Pourquoi ne peut-on pas manger que des bonbons ?;On ne peut pas manger que des bonbons ou des choses que l’on aime car le corps a besoin d’aliments variés pour être en pleine forme
Dans quel pays utilise-t-on des baguettes pour manger ?;En Chine et dans beaucoup de pays asiatiques
Quelle est la partie de la bouche qui permet de donner le goût des aliments ?;C’est la langue 
Qui transporte les repas de ses petits dans un « sac » ?;C’est le pélican qui possède une poche de peau sous son bec
"Qu&rsquo;est-ce que monter en amazone, dans un cirque ?";Autrefois, les femmes montaient en amazone
Pourquoi la forêt amazonienne est-elle en danger ?;La forêt amazonienne est en danger car elle subit une déforestation massive, c’est-à-dire que l’on coupe beaucoup d’arbres pour laisser de la place aux cultures
"Pourquoi les Indiens d&rsquo;Amérique s&rsquo;appellent-ils comme cela ?";Les Indiens d’Amérique sont en fait les premiers habitants du continent américain
Qui étaient les Sioux ?;Les Sioux étaient l’une des tribus indiennes qui habitaient le continent américain
Pourquoi les cow-boys portaient-ils des éperons sur leurs bottes ?;Les éperons des cow-boys leur permettaient de piquer les flancs de leur cheval et ainsi de le faire aller plus vite...
"Comment s&rsquo;appelait le chef de la police dans l&rsquo;Ouest américain ?";Le chef de la police était le sherif
Les indiens existent-ils encore ?;Oui, il existe encore des indiens, mais ils vivent dans de grandes réserves souvent éloignées de leurs terres d’origine
Les hommes et les dauphins sont-ils amis ?;On raconte que certains dauphins ont sauvé des humains de la noyade ou auraient aidé des pêcheurs à attraper du poisson
Où vit le poisson-clown ?;Le poisson-clown vit dans une anémone de mer
"Qui était Jeanne d&rsquo;Arc ?";Jeanne d’Arc était une jeune fille qui vivait au Moyen Âge
Qui a inventé le football ?;En réalité, le football serait inspiré d’un sport pratiqué en France il y a très longtemps
Combien de litres de lait donne une vache par jour ?;Une vache est traite deux fois par jours, le matin et le soir, tous les jours de l’année
Est-ce que le poney est le petit du cheval ?;Non 
Le cheval dort-il debout ?;Oui 
Comment les poules fabriquent-elles les coquilles de leurs œufs ?;La poule ne fabrique pas elle-même la coquille de ses futurs œufs
Quels sont les oiseaux qui ne peuvent pas voler ?;La quasi totalité des oiseaux volent, même un peu, comme les poules 
Est-ce que le poney est le petit du cheval ?;Non 
Le cheval dort-il debout ?;Oui 
Pourquoi le chien remue-t-il la queue ?;On dit que le chien remue la queue lorsqu’il est content
Comment les chats voient-ils la nuit ?;Les chats voient beaucoup mieux que nous dans l’obscurité
Pourquoi le chat fait-il le gros dos ?;On sait qu’un chat n’est pas content lorsqu’il montre les dents, remue la queue, baisse les oreilles et surtout quand il fait le gros dos et qu’il hérisse ses poils 
"Dans l&rsquo;Égypte ancienne, les momies n&rsquo;existaient-elles que pour les hommes ?";Eh non 
Pourquoi le lion a-t-il une crinière ?;Le lion, roi de la savane africaine, a une grosse crinière autour de la tête, au niveau du cou
"À l&rsquo;époque des dinosaures, est-ce que d&rsquo;autres animaux vivaient sur la Terre ?";Bien sûr 
Pourquoi les zèbres ont-ils des rayures ?;Certains scientifiques ont dit que les zèbres avaient des rayures pour se camoufler dans la savane et d’autres pour lutter contre la chaleur
"Qu&rsquo;est-ce qu&rsquo;un ornithorynque ?";L’ornithorynque est un animal qui vit en Australie et dans aucun autre pays de la planète 
"Pourquoi le paresseux s&rsquo;appelle-t-il ainsi ?";Le paresseux est un animal bien particulier 
Comment font les œufs de manchot pour ne pas geler en Antarctique ?;Grâce au papa manchot 
"Comment les araignées fabriquent-elles leur fil&nbsp;?";Les araignées fabriquent un fil collant, très solide et un peu élastique dans leur ventre, l’abdomen, pour construire leur toile
Une araignée est-elle un insecte ?;Eh non puisqu’une araignée a 8 pattes et non 6, comme tous les insectes
"C&rsquo;est quoi un carton rouge, au foot ?";Un carton rouge au foot est donné par l’arbitre à un joueur qui a fait une faute grave
Le plus vieil arbre du monde a-t-il plus de 4 000 ans ?;Eh oui 
Que doit-on faire pour respecter les arbres ?;Les arbres sont vivants et sont les poumons de la planète 
Que font les arbres à la planète ?;Les arbres « nettoient » l’air
"Quand commence et quand s&rsquo;arrête la préhistoire ?";La préhistoire est une période qui va de la naissance de la Terre jusqu’à l’invention de l’écriture, il y a environ 5 500 ans
"Comment s&rsquo;appelaient les ouvertures étroites dans les murs des châteaux forts ?";Les ouvertures étroites et hautes façonnées dans les murailles des châteaux forts s’appelaient des meurtrières
"Qu&rsquo;est-ce qu&rsquo;un « tomahawk » chez les Indiens d&rsquo;Amérique ?";Le « tomahawk », chez les Indiens d’Amérique est une sorte de massue, comme un marteau, à laquelle était attachée une grosse pierre...
À quoi correspondait « la tortue », chez les Romains ?;La tortue correspondait à l’une des techniques de défense de l’armée romaine
"Comment s&rsquo;appelaient les soldats romains ?";Les soldats romains s’appelaient les légionnaires
"En cas d&rsquo;attaque, comment s&rsquo;appelait la technique de défense des légionnaires romains ?";Cette technique s’appellait la tortue
"Combien pesait l&rsquo;armure du chevalier ?";L’armure complète du chevalier pouvait peser jusqu’à 25 kg 
"Comment s&rsquo;appelle le vêtement fait de pièces de métal que portait le chavalier pour se protéger des coups ?";Le vêtement s’appelle une cotte de maille
"Qui fabriquait l&rsquo;armure des chevaliers ?";L’homme qui fabriquait l’armure des chevaliers était le forgeron
Combien de temps dure un match de football ?;Le match se compose de deux mi-temps, chacune d’une durée de 45 minutes
Que signifie le mot « origami » ?;L’origami, cet art délicat du pliage du papier, est un mot japonais qui signifie plier (« oru ») et papier (« kami »)
"Qu&rsquo;est-ce que le chapiteau d&rsquo;un cirque ?";Le chapiteau d’un cirque est la tente en toile qui accueille le spectacle et les spectateurs
Comment se passe la vie dans un cirque ?;Travailler dans un cirque ambulant c’est vivre en groupe et voyager sur les routes
Existe-il toujours des pirates ?;Eh oui 
Qui était Neil Armstrong ?;Neil Armstrong était un astronaute américain
"Comment dorment les astronautes, dans l&rsquo;espace ?";Dans l’espace, il n’y a pas de gravité terrestre, c’est-à-dire que rien n’est retenu au sol
"Qu&rsquo;y a-t-il sur la Lune ?";Sur la Lune, il n’y a que des pierres et de la poussière
Quelles sont les différentes fonctions des joueurs de foot ?;Comme dans tous les sports, chaque joueur a une fonction particulière
Comment les pirates repéraient-ils les navires à attaquer ?;L’un des pirates, tout en haut du mât, surveillait l’horizon avec une longue vue
À quoi servaient les cartes au trésor ?;Les pirates passaient leur temps sur les océans à piller des navires
"En cas d&rsquo;attaque, comment s&rsquo;appelait la technique de défense des légionnaires romains ?";Cette technique s’appellait la tortue
Pourquoi les pirates avaient-ils souvent une jambe de bois, un œil ou un bras en moins ?;Lors des combats, les attaques étaient violentes et les blessures nombreuses 
"Qu&rsquo;est-ce qu&rsquo;un ornithorynque ?";L’ornithorynque est un mammifère amphibie (qui vit sur Terre et dans l’eau) au corps poilu, avec des pattes palmées munies de griffes, une queue de castor et un bec de canard 
"Qu&rsquo;est-ce qu&rsquo;un ornithorynque ?";L’ornithorynque est un animal qui vit en Australie et dans aucun autre pays de la planète 
Quels sont les oiseaux qui ne peuvent pas voler ?;La quasi totalité des oiseaux volent, même un peu, comme les poules 
Qui pond les plus gros œufs du monde ?;Il s’agit de l’autruche
Que permirent les voyages en avion ?;L’invention de l’avion permit de voyager beaucoup plus vite
Les chevaux se battent-ils ?;Les chevaux se battent rarement ou vraiment quand ils ont peur
Que mange la baleine ?;La baleine est le mammifère marin le plus grand au monde
Combien pèse une baleine ?;Une baleine peut peser jusqu’à 19 tonnes, c’est-à-dire l’équivalent de 30 éléphants 
"Comment s&rsquo;appelle le petit de la baleine ?";Le petit de la beleine s’appelle le baleineau
Où vivent les grandes baleines bleues ?;Les baleines bleues, avec leurs 33 mètres de long, sont les plus gros animaux ayant jamais existé 
"C&rsquo;est quoi, les pointes, en danse classique ?";Les pointes sont des chaussons de satin à bouts plats, qui permettent de danser en se tenant sur la pointe des pieds
Qui sont les danseurs étoiles ?;Les danseurs étoiles sont les meilleurs danseurs de l’Opéra
"Qu&rsquo;appelle-t-on un tutu ?";Le tutu est le costume que porte habituellement les danseuses de ballets classiques
Que signifie le mot « manga » ?;Les mangas sont ces bandes dessinées qui nous viennent du Japon et qui remportent un succès fou dans le monde
Le pirate Barbe-Noire a-t-il vraiment existé ?;Oui 
"Qu&rsquo;est-ce que c&rsquo;est que la basse-cour, dans la ferme ?";C’est là que vivent les animaux tels que les poules, les oies, les canards, les pintades, les dindons… tous les animaux à plumes 
Les Vikings étaient-ils des pirates ?;Oui, mais pas seulement 
Pourquoi les pirates avaient-ils souvent une jambe de bois, un œil ou un bras en moins ?;Lors des combats, les attaques étaient violentes et les blessures nombreuses 
Comment se dirige-t-on sur un voilier ?;Pour se diriger, on utilise une barre
"Qu&rsquo;est-ce qu&rsquo;un pirate ?";Un pirate c’est un ancien marin qui, devenu voleur des mers, attaque les navires pour leur voler leurs marchandises...
Pourquoi les bébés ne marchent-ils pas ?;Le corps des bébés, lorsqu’ils naissent, doit encore se perfectionner 
"Qu&rsquo;appelle-t-on les dents de lait ?";Les dents de lait sont les 20 premières dents qui poussent lorsque l’on est bébé
"Quel animal donne une fessée à son petit lorsqu&rsquo;il n&rsquo;est pas sage ?";C’est la maman éléphant
Quel est le plus grand bébé du monde ?;Il s’agit du girafeau, le bébé de la girafe
Quel père met au monde ses petits ?;Il s’agit de l’hippocampe
Qui transporte les repas de ses petits dans un « sac » ?;C’est le pélican qui possède une poche de peau sous son bec
"Qui s&rsquo;invite dans des coquillages vides ?";Il s’agit du bernard-l’ermite
Les femmes préhistoriques portaient-elles des bijoux ?;Eh oui, les hommes préhistoriques étaient de galants hommes 
À quel âge un jeune Indien pouvait partir chasser avec les hommes de sa tribu ?;À partir de 12 ans, un jeune Indien pouvait partir chasser le bison avec les hommes de sa tribu
Pourquoi les Indiens habitaient-ils dans des tipis ?;Les Indiens étaient un peuple de nomades, c’est-à-dire qu’ils se déplaçaient au rythme des saisons, pour suivre les troupeaux de bisons dont ils se nourrissaient
"Qu&rsquo;appelle-t-on « la conquête de l&rsquo;Ouest » ?";La conquête de l’Ouest correspond à l’arrivée des Européens sur le sol américain
"Est-ce qu&rsquo;un bœuf et un taureau, c&rsquo;est la même chose ?";Le taureau est le mâle qui s’accouple avec la vache pour faire de petits
Comment les hommes préhistoriques allumaient-ils les feux ?;Ils frottaient des pierres les unes avec les autres
Existe-t-il des maisons en paille et en bois ?;Oui 
Pourquoi ne peut-on pas manger que des bonbons ?;On ne peut pas manger que des bonbons ou des choses que l’on aime car le corps a besoin d’aliments variés pour être en pleine forme
Le chameau a-t-il une ou deux bosses ?;Le chameau a deux bosses
"Quelle est la différence lorsqu&rsquo;un cheval se cabre ou qu&rsquo;il rue ?";On dit qu’un cheval se cabre, lorsqu’il se lève sur ses postérieurs (jambes arrière) et agite ses antérieurs (jambes avant)
À quoi correspondait « la tortue », chez les Romains ?;La tortue correspondait à l’une des techniques de défense de l’armée romaine
Quel était le dinosaure le plus grand ?;Le dinosaure le plus grand est sans hésitation le brachiosaure
Les dinosaures étaient-ils tous géants ?;Non 
"Comment les poissons respirent-ils sous l&rsquo;eau ?";Les poissons respirent grâce à leurs branchies, conçues pour filtrer l’eau et ne garder que l’oxygène, contenu dans l’eau de mer
Qui était Pelé ?;Pelé est un footballeur brésilien, considéré comme le plus grand joueur de football de tous les temps
Comment Jules César est-il mort ?;Jules César, ce puissant empereur romain, a été assassiné
Pourquoi le canard a-t-il les pattes palmées ?;Le canard a les pattes palmées car cela lui permet de mieux nager
"Existe-il d&rsquo;autres Paris dans le monde ?";Eh bien oui 
La Tour Eiffel a-t-elle été construite pour durer ?;Non 
Pourquoi les insectes sont-ils petits ?;Les insectes sont petits (bien que certains peuvent atteindre 20 cm, plus grands que certains oiseaux !) à cause de leur carapace qui est en fait, leur squelette extérieur
